### ISSUE TITLE
Error 407 using proxy

### ISSUE THREAD

**Issue by gitpru** [flowable/flowable-engine#3039]
**Describe the bug**
When using the plugin through a proxy I get a 407 error code while testing the connection to collibra site even if HTTP and HTTPS variables are set and also the manual network settings in Eclipse General settings.

**Expected behavior**
The plugin should connect to the collibra site.

**Code**
none, only testing connection using HTTPS (port 443).

**Additional context**
Flowable Version on Eclipse BPMN 2.0 Designer	5.22.0	org.flowable.designer.feature.feature.group	Flowable
Flowable Task application is collibra Workflow manager (https://marketplace.collibra.com/listings/workflow-manager-for-eclipse/)   Workflow Manager	0.1.22	com.collibra.workflow.feature.group	COLLIBRA.

Here's a wireshark trace extract (with IP masking)
2861	92.551314	150.62.**.*6	194.5.**.**	HTTP	183	CONNECT my-dev.collibra.com:443 HTTP/1.1 
2862	92.561226	194.5.**.*6	150.62.**.**	TCP	60	[TCP Window Update] 8080 → 59828 [ACK] Seq=1 Ack=1 Win=263296 Len=0
2863	92.563223	194.5.**.**	150.62.**.*6	TCP	1314	8080 → 59828 [ACK] Seq=1 Ack=130 Win=263296 Len=1260 [TCP segment of a reassembled PDU]
2864	92.563223	194.5.**.**	150.62.**.*6	TCP	1314	8080 → 59828 [ACK] Seq=1261 Ack=130 Win=263296 Len=1260 [TCP segment of a reassembled PDU]
2865	92.563223	194.5.**.**	150.62.**.*6	HTTP	191	HTTP/1.1 407 Proxy Authentication Required  (text/html)

**Comment by tijsrademakers** [comment]
Hi @gitpru , this is not an issue with this Flowable project, therefore closing it.
